{
  "$schema": "https://json-schema.org/draft/2020-12/schema",
  "title": "payments.authorized.v1",
  "type": "object",
  "additionalProperties": false,
  "required": [
    "meta",
    "authorization",
    "amount",
    "payTo",
    "resource",
    "paymentIntentId",
    "runId"
  ],
  "properties": {
    "meta": {
      "type": "object",
      "required": [
        "eventId",
        "occurredAt",
        "producer",
        "correlationId"
      ],
      "additionalProperties": false,
      "properties": {
        "eventId": {
          "type": "string",
          "minLength": 1,
          "maxLength": 64
        },
        "occurredAt": {
          "type": "string",
          "format": "date-time"
        },
        "producer": {
          "type": "string",
          "pattern": "^[a-z][a-z-]{1,31}$"
        },
        "correlationId": {
          "type": "string",
          "maxLength": 64
        }
      }
    },
    "authorization": {
      "type": "object",
      "required": [
        "network",
        "asset",
        "payer",
        "nonce",
        "validBefore"
      ],
      "additionalProperties": false,
      "properties": {
        "network": {
          "const": "eip155:84532"
        },
        "asset": {
          "type": "string",
          "pattern": "^0x[0-9a-fA-F]{40}$"
        },
        "payer": {
          "type": "string",
          "pattern": "^0x[0-9a-fA-F]{40}$"
        },
        "nonce": {
          "type": "string",
          "pattern": "^0x[0-9a-fA-F]{64}$"
        },
        "validBefore": {
          "type": "integer",
          "minimum": 1
        }
      }
    },
    "amount": {
      "type": "object",
      "required": [
        "atomicUnits",
        "asset",
        "decimals"
      ],
      "additionalProperties": false,
      "properties": {
        "atomicUnits": {
          "type": "integer",
          "minimum": 0,
          "maximum": 9007199254740991
        },
        "asset": {
          "type": "string",
          "pattern": "^[A-Z0-9]{2,10}$"
        },
        "decimals": {
          "type": "integer",
          "minimum": 0,
          "maximum": 18
        }
      }
    },
    "payTo": {
      "type": "string",
      "pattern": "^0x[0-9a-fA-F]{40}$"
    },
    "resource": {
      "type": "string",
      "minLength": 1,
      "maxLength": 512
    },
    "paymentIntentId": {
      "type": "string",
      "format": "uuid"
    },
    "runId": {
      "type": "string",
      "format": "uuid"
    }
  }
}
