{"meta":{"eventId":"0b5c6a8e-3c1d-4b1e-9f0a-2f6d7c1e9a01","occurredAt":"2026-10-01T10:00:00Z","producer":"orchestrator","correlationId":"6ad4354c-8e79-4b49-b5d9-d45eb9689b41"},"authorization":{"network":"eip155:84532","asset":"0x036CbD53842c5426634e7929541eC2318f3dCF7e","payer":"0xdD542d774e0c0E546d76721396C69e113A644795","nonce":"0x5f1c8a2b9d3e4f60718293a4b5c6d7e8f90a1b2c3d4e5f60718293a4b5c6d7e8","validBefore":1790000060},"amount":{"atomicUnits":20000,"asset":"USDC","decimals":6},"payTo":"0x1111111111111111111111111111111111111111","resource":"http://seller-api:8081/v1/disclosures/ASELS/questions","paymentIntentId":"75f93933-72b5-4604-ad2c-063e3f4e6ed6","runId":"6ad4354c-8e79-4b49-b5d9-d45eb9689b41"}
